"dates","title","ressort"
2022-09-15,"Der Trend geht zum Drittwagen","Mobilität"
2022-09-15,"»Wir haben im Nahverkehr gerade ganz andere Sorgen«","Mobilität"
2022-09-14,"Wie Wien und Zürich die Autos aus der Stadt verdrängen","Mobilität"
2022-09-09,"Wüst verlangt drei weitere Milliarden Euro für den Nahverkehr","Politik"
2022-09-08,"Bundestag beschließt Coronaregeln für den Herbst","Politik"
2022-09-05,"49, 59 oder 69 Euro – was bringt das teure Billigticket?","Mobilität"
2022-09-05,"Wie teuer soll der Nachfolger für das 9-Euro-Ticket werden?","Wirtschaft"
2022-09-04,"Nackt ist eh doof","Kultur"
2022-09-03,"Warum der Abschied von der E-Klasse als Taxi so weh tut","Mobilität"
2022-09-03,"Nachfolge für 9-Euro-Ticket soll Anfang 2023 kommen","Politik"
2022-09-02,"»Dass das Ticket jetzt ausgelaufen ist, erleichtert mich«","Mobilität"
2022-09-01,"Forscher empfehlen Heizkostenzuschuss statt Gaspreisdeckel","Wirtschaft"
2022-08-31,"Prominente Deutsche fordern Fortsetzung des 9-Euro-Tickets","Wirtschaft"
2022-08-30,"Städte warnen vor Finanznot der Stadtwerke","Wirtschaft"
2022-08-29,"»Immer werden irgendwelche tollen Programme aufgelegt«","Politik"
2022-08-29,"»Massive Einschnitte« bei Schulbussen möglich","Wirtschaft"
2022-08-29,"Die »Letzte Generation« macht sich lächerlich","Politik"
2022-08-29,"9-Euro-Ticket spart fast zwei Millionen Tonnen CO₂ ein","Mobilität"
2022-08-28,"SPD will wegen steigender Energiekosten Hilfspaket schnüren","Politik"
2022-08-28,"»Jeder Fünfte hat die öffentlichen Verkehrsmittel neu für sich entdeckt«","Wirtschaft"
2022-08-28,"Umweltbundesamt spricht sich für Nachfolger des 9-Euro-Tickets aus","Mobilität"
2022-08-27,"Berlin kündigt eigene Nachfolge für 9-Euro-Ticket an","Politik"
2022-08-26,"Kommt jetzt bald das 69-Euro-Ticket?","Politik"
2022-08-26,"Wer kriegt die Kohle fürs Gas?","Politik"
2022-08-26,"Bundesländer machen Druck für neuen Billigfahrschein","Mobilität"
2022-08-26,"Wie der Superbilligtarif den Verkehr verändert hat","Mobilität"
2022-08-26,"Ist das noch schlechter Klimaschutz – oder schon Arbeitsverweigerung?","Wissenschaft"
2022-08-26,"Wie gut kennen Sie Ihre Nachbarn?","Politik"
2022-08-26,"»Am besten wäre ein komplett kostenloses ÖPNV-Angebot auf dem Land«","Mobilität"
2022-08-25,"Nah am Silbersee gebaut","Kultur"
2022-08-25,"FDP-Staatssekretär Theurer nun doch offen für 69-Euro-Fahrschein","Mobilität"
2022-08-24,"Der Dieselkiller von Bremervörde","Mobilität"
2022-08-22,"Rätselraten um eine Autobombe","Politik"
2022-08-22,"»Herr Lindner verkennt die Stimmung im Land«","Politik"
2022-08-22,"Gefälschte FDP-Plakate zum 9-Euro-Ticket – Staatsschutz ermittelt","Politik"
2022-08-19,"Verkehrsstaatssekretär will Tarifdschungel im ÖPNV auflösen","Politik"
2022-08-18,"Preise für Bus und Bahn ziehen an","Wirtschaft"
2022-08-12,"Erneut weniger Staus – vermutlich wegen des 9-Euro-Tickets","Mobilität"
2022-08-12,"Bahn frei!","Politik"
2022-08-11,"Verlängert das 9-Euro-Ticket!","Kultur"
2022-08-10,"Inflation schwächt sich erneut leicht ab","Wirtschaft"
2022-08-09,"Giffey gibt 9-Euro-Ticket Vorzug vor Steuersenkung","Mobilität"
2022-08-08,"Die teure Gratismentalität der Dienstwagen-Gesellschaft","Mobilität"
2022-08-08,"Mehrheit für Verlängerung des 9-Euro-Tickets","Politik"
2022-08-08,"9-Euro-Ticket führt zu mehr Verkehr","Mobilität"
2022-08-07,"Lindner will »keinerlei Mittel« für 9-Euro-Ticket einplanen","Politik"
2022-08-05,"Länder fordern für Anschlusslösung Geld vom Bund","Politik"
2022-08-03,"Plan B für die Maske","Politik"
2022-08-03,"Wie Google Maps unser Leben dominieren will","Wirtschaft"
2022-08-02,"»Das Bahnnetz ist teilweise stark überlastet«","Wirtschaft"
2022-08-01,"Grünenfraktionschefin Dröge will Steuerprivilegien für Dienstwagen kürzen","Wirtschaft"
2022-07-28,"Inflationsrate sinkt im Juli erneut leicht","Wirtschaft"
2022-07-27,"Welche Coronaregeln gelten im Urlaub?","Reise"
2022-07-26,"Haushalte gaben 2020 ein Drittel weniger für Bus, Bahn und Taxi aus","Wirtschaft"
2022-07-24,"Grüne wollen 9-Euro-Ticket statt umweltschädlicher Subventionen","Mobilität"
2022-07-24,"9-Euro-Ticket führt zu Fahrgastverlust bei Fernbussen","Wirtschaft"
2022-07-23,"Lindner lehnt weitere Finanzierung des 9-Euro-Tickets strikt ab","Mobilität"
2022-07-20,"







","Mobilität"
2022-07-20,"9-Euro-Ticket forever – das Geld liegt auf der Straße","Politik"
2022-07-19,"Welche Lehren wir schon jetzt aus dem 9-Euro-Ticket ziehen können","Mobilität"
2022-07-19,"Wissing hält Nachfolger für 9-Euro-Ticket für möglich","Wirtschaft"
2022-07-18,"Das große Feilschen auf dem Energiebasar","Politik"
2022-07-18,"Landkreise sehen 365-Euro-Jahresticket kritisch – Wissing will »Tarifdschungel« beseitigen","Politik"
2022-07-14,"Verkehrsunternehmen schlagen 69-Euro-Fahrschein ab September vor","Wirtschaft"
2022-07-13,"Mit der Seilbahn am Klimaziel vorbei","Mobilität"
2022-07-13,"Wissing will Klimaziele mithilfe von E-Autos, Rädern und ÖPNV erreichen","Wirtschaft"
2022-07-12,"»Lieber eine kalte Dusche im Sommer als eine kalte Wohnung im Winter«","Panorama"
2022-07-10,"Wie es nach dem 9-Euro-Ticket weitergehen könnte","Politik"
2022-07-08,"Briefe","Community"
2022-07-01,"Deutsche wünschen sich bundesweit gültiges 365-Euro-Ticket","Mobilität"
2022-07-01,"Wie schlimm steht es um die Bahn, Herr Verkehrsminister?","Politik"
2022-06-30,"Peinlich statt pünktlich","Politik"
2022-06-30,"Verkehrsbetriebe melden 21 Millionen verkaufte 9-Euro-Tickets in nur einem Monat","Wirtschaft"
2022-06-29,"Grüne Jugend fordert dauerhaftes 9-Euro-Ticket","Politik"
2022-06-28,"Warum es in Norwegen schon heute (fast) ohne neue Verbrenner klappt","Mobilität"
2022-06-27,"Bundesregierung erwägt »Klimaticket« für den Regionalverkehr","Wirtschaft"
2022-06-27,"Finanzminister Lindner gegen Verlängerung von Tankrabatt und 9-Euro-Ticket","Wirtschaft"
2022-06-25,"In Ostwestfalen hat die grüne Seele Ruh'","Politik"
2022-06-24,"Scholz stürzt ab, grüne Minister behaupten sich","Panorama"
2022-06-24,"Wer vom 9-Euro-Ticket profitiert – und wo es floppt","Mobilität"
2022-06-18,"Ring frei – so will Köln ein deutsches Kopenhagen werden","Mobilität"
2022-06-16,"Wer hat denn das verzapft?","Politik"
2022-06-16,"Mehrheit nutzt 9-Euro-Ticket für die Freizeit","Mobilität"
2022-06-15,"Bremer SPD fordert Nachfolge für 9-Euro-Ticket","Politik"
2022-06-13,"»Mit den 2,5 Milliarden Euro hätte man sehr viel machen können«","Politik"
2022-06-13,"Ein Viertel mehr Passagiere nahm den Zug","Wirtschaft"
2022-06-10,"Briefe","Community"
2022-06-09,"Keiner will mehr Trucker sein","Panorama"
2022-06-08,"Dauerhaft günstige Tickets gefordert","Mobilität"
2022-06-07,"Linkenchefin Wissler will erste Klasse der Bahn für alle öffnen","Reise"
2022-06-06,"Warum schlecht informierte Fahrgäste die Bahnen verstopfen","Mobilität"
2022-06-03,"Ticket ins Chaos","Politik"
2022-06-02,"Ticket mit Tücken","Politik"
2022-06-02,"»Die Menschen haben es in ihr Herz geschlossen«","Wirtschaft"
2022-06-02,"Stimmen zur Bahn: »Das ist doch mega!« – »Nichts als Effekthascherei«","Politik"
2022-06-01,"Bahnbeauftragter will nicht mehr »heiße Luft« durch die Gegend fahren lassen","Mobilität"
2022-06-01,"»Ist hier noch frei?« – »Ungern«","Mobilität"
2022-06-01,"»Züge gut gefüllt, aber man findet Platz«","Mobilität"
2022-06-01,"Zwölf Bahn-Tipps für (Wieder-)Einsteiger","Reise"
2022-06-01,"Wie erleben Sie den Neun-Euro-Wahnsinn?","Politik"
2022-05-31,"Wo es in Bahnen und Bussen ab Mittwoch besonders eng wird","Mobilität"
2022-05-30,"Verkehrsunternehmen erwarten Preisschub ab September","Wirtschaft"
2022-05-28,"Neue Bahn auf alten Gleisen","Mobilität"
2022-05-24,"»Wir müssen die Stadt auf links drehen«","Mobilität"
2022-05-23,"Was Sie zum Neun-Euro-Ticket wissen müssen","Mobilität"
2022-05-23,"»Man will ja nicht, dass ein Klavier an einem vorbeifährt«","Start"
2022-05-22,"Schon zehntausende Neun-Euro-Tickets verkauft","Mobilität"
2022-05-20,"Das sind Deutschlands schönste Regionalbahnrouten","Reise"
2022-05-17,"Was braucht das Land für ein »sozialdemokratisches Jahrzehnt«?","Politik"
2022-05-16,"Verkehrsunternehmen rechnen mit 30 Millionen Neun-Euro-Ticket-Nutzern","Mobilität"
2022-05-16,"Das Neun-Euro-Wirrwarr an deutschen Unis","Start"
2022-05-14,"Bundesweite Sieben-Tage-Inzidenz sinkt weiter – und liegt nun bei 477,0","Wissenschaft"
2022-05-09,"Das sind die Alternativen zu Elektroprämien","Mobilität"
2022-05-09,"







","Mobilität"
2022-05-09,"Wrackt diese Prämie ab","Mobilität"
2022-05-06,"SPD kritisiert Wissings Pläne für Elektroautoprämie","Politik"
2022-05-05,"Geht Deutschland auf die Barrikaden?","Mobilität"
2022-04-27,"Mehrheit der Deutschen will Neun-Euro-Ticket nutzen","Wirtschaft"
2022-04-27,"Das bringt das Energie-Entlastungspaket","Politik"
2022-04-27,"ADAC ruft zum Fahrradfahren auf","Wirtschaft"
2022-04-27,"Gauck nennt Lawrow-Aussagen zu drittem Weltkrieg »Einschüchterungsversuch«","Ausland"
2022-04-26,"Neun-Euro-Ticket sorgt weiter für Streit","Wirtschaft"
2022-04-24,"Wie geht es weiter mit dem Neun-Euro-Ticket?","Politik"
2022-04-16,"Wird das Neun-Euro-Ticket der Verkehrswende womöglich schaden?","Wissenschaft"
2022-04-13,"Wie das neue Neun-Euro-Ticket funktionieren soll","Mobilität"
2022-04-08,"Unternehmen des ÖPNV fordern 1,5 Milliarden Euro vom Bund","Wirtschaft"
2022-04-08,"Warum Bus und Bahn für Familien oft keine Alternative sind","Mobilität"
2022-04-07,"Zahl der Passagiere in Bussen und Bahnen sinkt auf Tiefstand","Mobilität"
2022-04-06,"Semesterticket für 2,07 Euro ist ungültig","Panorama"
2022-04-05,"»Rabatt« auf Semestertickets in Nürnberg wegen Automatenfehlers","Panorama"
2022-04-01,"Warum das Neun-Euro-Monatsticket auf sich warten lässt","Mobilität"
2022-03-28,"Hoffnungsträger Elektroauto – wie es nützt und wie es schadet","Mobilität"
2022-03-25,"220.000 Menschen demonstrieren in Deutschland für den Klimaschutz","Panorama"
2022-03-25,"Verkehrsminister empfehlen Nulltarif statt Neun-Euro-Ticket","Mobilität"
2022-03-25,"Wie geht noch mal verzichten?","Politik"
2022-03-24,"Rabattschlacht gegen Putin","Wirtschaft"
2022-03-24,"Ökonomen loben Energiepauschale, harsche Kritik an Benzinpreissenkung","Wirtschaft"
2022-03-18,"Was hilft gegen hohe Spritpreise?","Wirtschaft"
2022-03-16,"Die bessere Spritpreisbremse","Mobilität"
2022-03-15,"»Ein Tankrabatt ist eine der absurdesten Ideen aus den letzten 20 Jahren«","Wissenschaft"
2022-03-14,"Wie stehen die Chancen für ein Treffen von Putin und Selenskyj?","Politik"
2022-03-14,"SPD-Linke will Schuldenbremse auch 2023 aussetzen","Politik"
2022-03-06,"Vom Scholzomat zum Scholzdertat?","Politik"
2022-03-05,"Attacke aufs Auto","Mobilität"
2022-02-26,"»Wir müssen so schnell wie möglich weg vom Öl«","Mobilität"
2022-02-17,"Warum die Avantgarde Bus und Bahn fährt","Mobilität"
2022-02-17,"Deutschlands gewaltiges Datenproblem","Netzwelt"
2022-02-10,"Warum Annalena Baerbock ein Elektroauto bekommt – und Robert Habeck nicht","Mobilität"
2022-02-09,"Polizei korrigiert Angaben zu Angriff auf 17-Jährige in Berlin","Panorama"
2022-02-08,"Milliarden für den öffentlichen Verkehr werden nicht abgerufen","Wirtschaft"
2022-02-08,"Wer hat Angst vor der autofreien City?","Mobilität"
2022-01-11,"Fahrrad statt Auto – auch auf dem Land möglich","Mobilität"
2022-01-07,"Sachsen will strenge Corona-Regeln lockern","Wissenschaft"
2021-12-30,"SPD-Politiker sieht keinen Spielraum für günstigeren Nahverkehr und 365-Euro-Ticket","Mobilität"
2021-12-27,"Tausende Menschen protestieren gegen Coronabeschränkungen","Wissenschaft"
2021-12-23,"Erste Klasse im Berliner ÖPNV würde Fahrgäste anlocken","Wirtschaft"
2021-12-23,"Mann soll 150 Impftermine gebucht haben – System lahmgelegt","Wissenschaft"
2021-12-21,"Franziska Giffey zur Bürgermeisterin in Berlin gewählt","Politik"
2021-12-15,"Seilbahnen sollen Lücken im Nahverkehr schließen","Mobilität"
2021-12-14,"Sollen sie doch Flugtaxi fliegen, mir egal","Kultur"
2021-12-13,"Berliner Verkehrsbetriebe verkaufen essbares Hanfticket","Mobilität"
2021-12-11,"Der Autoboss und seine Ampel","Mobilität"
2021-12-08,"»Jetzt hab ich es eilig und werde kontrolliert«","Panorama"
2021-11-26,"Immer mehr Unions-Länderchefs drängen auf Vorziehen der Bund-Länder-Runde","Politik"
2021-11-26,"»Da lernt man sich auch menschlich kennen«","Politik"
2021-11-26,"







","Mobilität"
2021-11-24,"Jubel auf der linken Spur","Politik"
2021-11-21,"Lesen Sie hier den Koalitionsvertrag im Wortlaut","Wissenschaft"
2021-11-19,"Wladimir Putin bekommt die Booster-Impfung","Wirtschaft"
2021-11-18,"Wer hat es leichter – der Unternehmensgründer oder sein Sohn?","Politik"
2021-11-15,"Auf diese neuen Maßnahmen haben sich Bund und Länder geeinigt","Mobilität"
2021-11-13,"Seniorinnen und Senioren können Führerschein gegen ÖPNV-Ticket tauschen","Mobilität"
2021-11-03,"Wo Bus- und Bahnfahren besonders teuer ist – und wo billig","Wirtschaft"
2021-11-03,"Jedes siebte Innenstadtgeschäft könnte auf Dauer leer stehen","Politik"
2021-10-30,"Söder will strengere Maßnahmen für Ungeimpfte","Mobilität"
2021-10-29,"»Es fließt viel Geld an Leute, die es nicht brauchen«","Wirtschaft"
2021-10-29,"»Die Hoffnung, dass alle nur noch elektrisch fahren, wird sich nicht erfüllen«","Mobilität"
2021-10-29,"So schwindet die Reichweitenangst","Politik"
2021-10-28,"»Wir stimmen dem Koalitionsvertrag nur zu, wenn sich wirklich was verändert«","Start"
2021-10-27,"55 Millionen Menschen ohne ausreichenden Nahverkehr","Wirtschaft"
2021-10-22,"Diese Fallen lauern jetzt in den Koalitionsverhandlungen","Politik"
2021-10-10,"Ferngesteuert durch die City","Mobilität"
2021-10-08,"Mobilfunkausbau in Berliner U-Bahn verzögert sich","Wirtschaft"
2021-10-01,"So verstehst du das Zahlenchaos","Start"
2021-10-01,"Genesene mindestens ein Jahr vor Corona geschützt","Wissenschaft"
2021-09-28,"Mehr als 700.000 Menschen nutzen bundesweites ÖPNV-Abo","Mobilität"
2021-09-27,"Diese Klimaprobleme muss die neue Regierung dringend lösen","Wissenschaft"
2021-09-25,"Wie die Parteien die Bahn stärken wollen","Mobilität"
2021-09-21,"Fahrgäste kommen zurück zu Bus und Bahn","Mobilität"
2021-09-12,"Freie Fahrt in ganz Deutschland ab Montag – warum nicht immer?","Mobilität"
2021-09-11,"»Das wäre ein bedingungsloses Grundeinkommen für angehende Akademiker!« – »Das ist mir zu plakativ«","Start"
2021-09-10,"Baerbock plant massiven Ausbau des öffentlichen Nahverkehrs","Politik"
2021-09-08,"»Wir sagen ja nicht: Morgen entweder 100 Prozent full socialism oder gar nichts«","Politik"
2021-09-07,"Steuert das Fahrrad in dieselbe Sackgasse, in der das Automobil schon steckt?","Mobilität"
2021-09-07,"Autoindustrie verurteilt Störaktionen bei IAA","Mobilität"
2021-09-06,"Was die Grünen wollen – und was die Menschen so umtreibt","Politik"
2021-09-06,"Österreichs Kanzler Kurz schließt Lockdown aus – aber nur für Geimpfte","Wissenschaft"
2021-09-04,"Es hat sich ausgehupt","Mobilität"
2021-08-30,"»Seit wann ist Coolness ein Faktor in der Politik?«","Politik"
2021-08-29,"Allons enfants – mit Tempo 30","Mobilität"
2021-08-27,"Kosten von fast 50 Milliarden Euro, zahlen sollen die Autofahrer","Wirtschaft"
2021-08-27,"Lastenrad statt Dienstwagen","Mobilität"
2021-08-19,"Mit deutscher Gründlichkeit im Stich gelassen","Politik"
2021-08-19,"Der Abschied vom Auto fällt aus","Mobilität"
2021-08-13,"»Wer im freien Fall auf den Erdboden zurast, sollte nicht über die Kosten für den Fallschirm debattieren«","Kultur"
2021-08-09,"»Das kann dazu beitragen, die Infektion in ganz Deutschland zu verteilen«","Mobilität"
2021-08-09,"Wer ein ÖPNV-Abo hat, darf im September damit im ganzen Land fahren","Mobilität"
2021-08-08,"Eine feministische Verkehrspolitik hilft vor allem den Männern","Wissenschaft"
2021-08-06,"Vorfahrt für Frauen","Politik"
2021-07-11,"Was sich der Nahverkehr von Netflix abguckt","Mobilität"
2021-06-16,"Briten melden höchsten Neuinfektionswert seit Februar","Wissenschaft"
2021-06-04,"Linkspartei will Autowerbung verbieten – aber keinen höheren CO₂-Preis","Politik"
2021-05-23,"Die Linke hat schärfere Klimaziele als die Grünen – doch sie hadert mit ihrem Kurs","Politik"
2021-05-10,"Wie sicher sind Bus und Bahn?","Wissenschaft"
2021-04-14,"Der Abtrünnige","Mobilität"
2021-02-15,"Wetterdienst warnt vor gefährlicher Glätte","Panorama"
2021-01-22,"So bereitet sich der ÖPNV auf die verschärfte Maskenpflicht vor","Panorama"
2021-01-21,"Wieso sollen Fahrgäste in der S-Bahn den Mund halten, Herr Wortmann?","Panorama"
2021-01-04,"»Es muss unser gemeinsames Ziel sein, den privaten Pkw überflüssig zu machen«","Wirtschaft"
2020-12-12,"Frankfurts OB lockt zum Adventsshopping in die City – und erntet Kritik","Politik"
2020-10-17,"""Auf dem Land ist der Linienbus ein Auslaufmodell""","Mobilität"
2020-10-09,"Busfahrer in Berlin soll elf Unfälle vorgetäuscht haben","Panorama"
2020-10-02,"Ver.di kündigt weitere Streiks im öffentlichen Nahverkehr an","Wirtschaft"
2020-10-01,"Briefe","Politik"
2020-08-27,"Wie Dieselbusse auf Elektro umgerüstet werden könnten - und wer das verhindert","Mobilität"
2020-07-10,"







","Panorama"
2020-06-12,"Die unglaubliche Reise in einem verrückten Bus","Mobilität"
2020-05-13,"""Unter den oberen Zehntausend fährt so gut wie niemand mehr öffentlich""","Mobilität"
2020-05-08,"Kurz vor Totalschaden","Mobilität"
2020-04-24,"Meine Firma, meine Fabrik, meine Haltestelle","Mobilität"
2020-04-21,"Italien will Kauf von Fahrrädern und Tretrollern fördern","Panorama"
2020-04-20,"Baden-Württemberg führt Maskenpflicht ein","Panorama"
2020-04-17,"Söder kündigt Maskenpflicht in Bayern an","Panorama"
2020-04-17,"Mecklenburg-Vorpommern führt Mund-Nasen-Schutz-Pflicht ein","Mobilität"
2020-04-17,"Clevershuttle schnappt Bussen und Bahnen viele Passagiere weg","Panorama"
2020-04-03,"Sachsen führt als erstes Bundesland Mund-Nasen-Schutz-Pflicht ein","Politik"
2020-03-30,"Briefe","Mobilität"
2020-03-19,"Abstand halten - nur hier nicht","Mobilität"
2020-03-14,"Gefährliche Verknappung","Mobilität"
2020-02-29,"Abgefahren!","Mobilität"
2020-02-25,"Tickets bezahlen oder gratis fahren - welchem Modell gehört die Zukunft?","Mobilität"
2020-01-30,"Bundestag stimmt über Extra-Milliarden für Busse und Bahnen ab","Wirtschaft"
2020-01-28,"Verband fordert besseres ÖPNV-Angebot statt billiger Tickets","Mobilität"
2019-12-29,"Tickets im Nahverkehr werden in vielen Städten teurer","Wirtschaft"
2019-12-26,"Schwer, teuer, gefährlich - die Mobilitäts-Flops des Jahres 2019","Mobilität"
2019-12-20,"Nahverkehrsbetriebe finden kaum neue Kunden","Wirtschaft"
2019-12-17,"Der ÖPNV ist ein Spalter","Mobilität"
2019-12-06,"Autoland ist wutentbrannt","Mobilität"
2019-12-05,"Bisherige Fahrverbote in Hamburg unzureichend","Mobilität"
2019-12-02,"In diesen Städten fährt man günstig Bus und Bahn","Mobilität"
2019-11-15,"Bund investiert 20-mal so viel Forschungsgelder in Kfz wie in ÖPNV","Mobilität"
2019-11-05,"Liebe Leserin, lieber Leser, guten Abend,","Politik"
2019-11-05,"So viel kostet Autofahren - auch Menschen, die nicht Auto fahren","Mobilität"
2019-10-25,"""Das Auto ist zu Recht umstritten""","Mobilität"
2019-10-24,"Urban Planners Herald End of Cars in Cities","International"
2019-10-17,"Ridesharing für Rollstuhlfahrer","Mobilität"
2019-09-20,"Was das Klimapaket für den Verkehr bedeutet","Mobilität"
2019-09-19,"So realistisch sind die Forderungen der Autokritiker","Mobilität"
2019-09-17,"Liebe Leserin, lieber Leser, guten Abend,","Politik"
2019-09-17,"Deutschland im Autorausch","Mobilität"
2019-09-07,"Rettet das 365-Euro-Ticket Deutschlands Innenstädte?","Mobilität"
2019-09-06,"Briefe","Politik"
2019-08-30,"ÖPNV-Nutzer sollen höhere Pendlerpauschale bekommen als Autofahrer","Wirtschaft"
2019-08-28,"Grünenabgeordneter will Extra-Urlaubstag für Radfahrer","Job & Karriere"
2019-08-22,"Giffey fordert freie Bahnfahrt auch für Freiwilligendienstler","Politik"
2019-08-16,"""E-Scooter und Busse sind eine sehr gefährliche Kombination""","Mobilität"
2019-08-15,"Streit um Abschaffung der ersten Klasse","Reise"
2019-08-12,"Fünfjahresplan für kostenlosen Nahverkehr","Mobilität"
2019-08-09,"Dutzende deutsche Städte im Klimanotstand","Wissenschaft"
2019-08-07,"Darum wird Fleisch niedriger besteuert als Babynahrung","Wirtschaft"
2019-08-06,"Selten so geschämt","Mobilität"
2019-08-03,"Grüne erwägen Pflichtticket für Touristen","Reise"
2019-07-31,"Hamburg startet Testbetrieb mit autonomem Kleinbus","Mobilität"
2019-07-31,"Regierung beschließt Wohlfühlpaket für E-Autofahrer","Mobilität"
2019-07-29,"Bloß keine neue Steuer","Politik"
2019-07-24,"Union will Pendlerpauschale für Arbeitnehmer erhöhen","Mobilität"
2019-07-17,"Uber startet in Hamburg - wieder","Mobilität"
2019-07-10,"Monheim bekommt kostenlosen Nahverkehr","Mobilität"
2019-07-03,"""Jede Normallösung ist eine vertane Chance""","Wirtschaft"
2019-07-01,"""Ihnen hätte ich es ja nicht zugetraut"" - wie junge Politiker die Stadträte erobern","Politik"
2019-07-01,"SPD, Grüne und Linke einigen sich auf Koalitionsvertrag","Politik"
2019-06-28,"Autos raus","Politik"
2019-06-28,"Mobil ohne Stau","Politik"
2019-06-15,"Worauf Sie beim E-Scooter-Kauf achten sollten","Mobilität"
2019-05-23,"Wuchtsummer","Mobilität"
2019-05-18,"Regierungsberater wollen City-Maut und Ausbau des Nahverkehrs","Mobilität"
2019-05-11,"Uber das Auto hinaus","Mobilität"
2019-05-03,"Fahren Sie etwa noch im eigenen Auto?","Wirtschaft"
2019-05-03,"Uberholmanöver","Wirtschaft"
2019-05-03,"Briefe","Politik"
2019-04-26,"""Zwei Drittel aller Autos müssen verschwinden - und zwar nicht nur von den Straßen""","Mobilität"
2019-04-16,"Sorry, Fridays for Future, aber: eine CO2-Steuer würde die Falschen treffen","Panorama"
2019-04-15,"Wirklich mobil ohne Auto? So schlägt Moia sich im Alltag","Mobilität"
2019-04-13,"So funktioniert VWs Volksfahrdienst","Mobilität"
2019-04-12,"Ein-Euro-Ticket für alle, die ihr Auto abmelden","Mobilität"
2019-04-11,"Mehrheit lehnt E-Roller auf Fußwegen ab","Mobilität"
2019-04-10,"""Schöne neue Welt der Mobilität - da muss ich lachen""","Mobilität"
2019-03-26,"Diese Mini-Busse rollen bald durch Monheim - ohne Fahrer","Mobilität"
2019-03-13,"Warum das Elektroroller-Experiment in Madrid scheiterte","Wirtschaft"
2019-03-02,"Danke, liebe ""Fridays for Future""-Jugend, dass du unsere Welt rettest!","Panorama"
2019-02-27,"Auto? Ist bald überflüssig","Mobilität"
2019-02-24,"So viel kostet ein Abo fürs Auto","Mobilität"
2019-02-21,"Liebe Leserin, lieber Leser,","Politik"
2019-02-19,"Liebe Leserin, lieber Leser, guten Abend,","Politik"
2019-02-19,"Liebe Leserin, lieber Leser,","Politik"
2019-02-15,"In Berlin streiken Bus- und Bahnfahrer – und die Menschen sehen es mit Humor und twittern","Netzwelt"
2019-01-31,"Feinstaub­belastungs­leugner","Politik"
2019-01-18,"Die Müll-Lüge","Wirtschaft"
2019-01-18,"Der dreckige Rest","Politik"
2019-01-10,"Diese Menschen haben gute Gründe fürs Schwarzfahren","Panorama"
2019-01-01,"Deutscher Städtetag warnt vor Verkehrskollaps","Mobilität"
2018-12-28,"Die spannendsten Erfindungen für Autos, Busse, Fahrräder","Mobilität"
2018-12-07,"Das letzte Einhorn","Politik"
2018-12-06,"Luxemburg will als erstes Land der Welt komplett kostenlosen Nahverkehr einführen","Panorama"
2018-11-07,"Wo der Verkehr am saubersten und sichersten ist","Mobilität"
2018-10-18,"Schüler fahren künftig umsonst Bus und Bahn","Mobilität"
2018-10-15,"Das Geisterrad von Magdeburg","Mobilität"
2018-10-14,"Hofreiter schlägt bundesweite Ein-Euro-Tickets für Busse und Bahnen vor","Mobilität"
2018-10-12,"Wo Bus- und Bahnfahren am günstigsten ist","Mobilität"
2018-10-12,"Hier ist der ÖPNV besonders preiswert","Mobilität"
2018-09-28,"Wie die Grünen jetzt auch in Bayern an die Macht wollen","Politik"
2018-09-28,"»Fahrt ins Paradies«","Politik"
2018-09-18,"Preise für Bus und Bahn steigen viel schneller als fürs Autofahren","Mobilität"
2018-09-05,"Richter setzt Frankfurt Frist für saubere Luft","Mobilität"
2018-08-24,"Titel, Flugtaxis, Europareise, SPIEGEL BIOGRAFIE","Politik"
2018-08-24,"Titel / Flugtaxis / Europareise / SPIEGEL BIOGRAFIE","Politik"
2018-08-20,"Bahn investiert in Carsharing für Schulkinder ","Mobilität"
2018-08-16,"Verbraucherschützer werfen Bahn irreführende Werbung für City-Ticket vor","Reise"
2018-08-03,"Ist Carsharing in Großstädten wirklich nachhaltig?","Panorama"
2018-07-18,"Bahn will Autofahrer von der Straße locken","Reise"
2018-07-13,"""Ich habe mein Auto kaum vermisst""","Mobilität"
2018-07-11,"Berliner S-Bahn will Verspätungen ausgleichen – indem sie nicht mehr überall hält","Panorama"
2018-06-29,"In Dünkirchen dürfen alle gratis Bus fahren","Mobilität"
2018-06-28,"Mehr Rechte für Radler","Mobilität"
2018-05-28,"Das kommt auf Autofahrer in Hamburg zu","Mobilität"
2018-05-24,"Wir machen Mobilität","Mobilität"
2018-05-05,"Diese Straßenbahn-Fahrer spielen Bowling mit ihren Fahrzeugen","Panorama"
2018-05-04,"Love is in the Air - unser neues Portal planestream","Wissenschaft"
2018-04-27,"Hamburg genehmigt VW-Fahrdienst Moia","Mobilität"
2018-04-20,"Menschen im öffentlichen Dienst verdienen jetzt mehr – aber ist das genug?","Start"
2018-04-16,"Dieser Mann hat Carsharing aufs Dorf gebracht","Start"
2018-04-13,"Schulze prescht bei Gratis-ÖPNV vor","Mobilität"
2018-04-10,"Stressige Wochen für Pendler im Rheinland","Job & Karriere"
2018-04-10,"Zehntausende Passagiere von Flugausfällen betroffen","Reise"
2018-03-26,"Charité testet autonome Busse","Mobilität"
2018-03-15,"Günstige Tickets statt Gratis-Nahverkehr","Mobilität"
2018-03-09,"Deutschlands Pendlerproblem - und was helfen würde","Mobilität"
